LegalNm,BusNm,Address,City,State,Country,Zipcode,Phone_Number,Website,Total_Assets,Clients
PIHL FINANCIAL PLANNING LLC,PIHL FINANCIAL PLANNING,,,,,,503-730-5093,https://www.pihlfinancialplanning.com,11446515,11-25
"PRINCE, WILLIAM L","PRINCE, WILLIAM L",,,,,,858-900-2113,,11450000,0
"LEXINGTON CAPITAL, LLC","LEXINGTON CAPITAL, LLC",,,,,,612-799-0661,,11455521,11-25
"RIGHTWAY INVESTMENTS, PLLC","RIGHTWAY INVESTMENTS, PLLC",7 THORN BERRY PLACE,THE WOODLANDS,TX,United States,77381,713-304-6199,HTTP://WWW.RIGHTWAYINVEST.COM,11458019,1-10
"ADVANCED ADVISOR GROUP, LLC","ADVANCED ADVISOR GROUP, LLC",1995 EAST RUM RIVER DRIVE S,CAMBRIDGE,MN,United States,55008,763-689-9023,HTTPS://WWW.FACEBOOK.COM/EDUCATORSFINANCIAL/,11460173,51-100
Q(X) BRANCH RESERVE INVESTMENTS LLC,Q(X) BRANCH RESERVE INVESTMENTS LLC,,,,,,302-428-1705,,11465100,
"DIPISA, STEPHEN A.",STEPHEN A. DIPISA REGISTERED INVESTMENT ADVISOR,,,,,,212-874-3229,,11465133,
DELLER WEALTH MANAGEMENT LLC,DELLER WEALTH MANAGEMENT LLC,418 N MAIN ST.,ROYAL OAK,MI,United States,48067,248-565-3777,https://www.facebook.com/dellerwealthmanagement,11473707,1-10
"FRONTSIGHT WEALTH ADVISORS, LLC","FRONTSIGHT WEALTH ADVISORS, LLC",2762 EAST CENTER STREET,KINGSPORT,TN,United States,37664,(800) 815-5479,,11474227,11-25
THE RAFFIN GROUP LLC,THE RAFFIN GROUP LLC,,,,,,650-793-8639,,11476009,
"LEGACY WEALTH PLANNING, LLC","LEGACY WEALTH PLANNING, LLC",5750 W. 95TH STREET,OVERLAND PARK,KS,United States,66207,913-648-4657,HTTP://WWW.LWP-KC.COM,11482776,26-50
DANNY ROBLES VISION WEALTH ADVISORS LLC,VISION WEALTH ADVISORS LLC,11912 SLIDE RD.,LUBBOCK,TX,United States,79424,806-553-2800,https://twitter.com/advisorsvision1,11482823,26-50
"MERCURY CAPITAL MANAGEMENT, INC.","MERCURY CAPITAL MANAGEMENT, INC.",,,,,,913-626-9330,,11484540,
GREYFIELD CAPITAL MANAGEMENT LLC,GREYFIELD CAPITAL MANAGEMENT LLC,,,,,,904-775-8818,https://linktr.ee/GreyfieldCap,11490745,0
K-WM LLC,KOVAR WEALTH MANAGEMENT,200 CHRISTIE ST.,LUFKIN,TX,United States,75904,(936) 899-5629,http://www.KovarWealth.com,11497490,0
SWEATER INDUSTRIES LLC,SWEATER INDUSTRIES LLC,2000 CENTRAL AVE.,BOULDER,CO,United States,80301,1-888-577-7987,https://www.linkedin.com/company/sweaterventures,11499745,
"HERNANDEZ, JESSE",HERNANDEZ FINANCIAL,451 S. 6TH STREET,SUNNYSIDE,WA,United States,98944,509-839-1002,HTTP://WWW.FEE-PLANNER.COM,11500000,1-10
"BIRD CAPITAL GROUP, INC.","BIRD CAPITAL GROUP, INC.",,,,,,713-302-3312,HTTP://WWW.BIRDCAPITALGROUP.COM/,11500000,0
"COMMONWEALTH ASSET MANAGEMENT GROUP, LLC","COMMONWEALTH ASSET MANAGEMENT GROUP, LLC",10501 WEST DRIVE,FAIRFAX,VA,United States,22030,703-250-6060,https://www.retirementchanges.com/,11500000,1-10
"FINNESTAD, DAVID, DEL",FINNESTAD FINANCIAL,,,,,,815-409-1500,,11500000,
"ZALES INVESTMENT MANAGEMENT, INC","ZALES INVESTMENT MANAGEMENT, INC",,,,,,719-337-6345,,11500000,0
NURTURE INVESTMENT STRATEGIES LLC,NURTURE INVESTMENT STRATEGIES LLC,,,,,,(805) 403-2962,https://www.nurtureinvestmentstrategies.com/,11505679,
"ECAPITAL ADVISORS, INC.","ECAPITAL ADVISORS, INC.",,,,,,254-722-3877,,11511338,1-10
"TUGGLE & RUSSELL, L.L.C.","TUGGLE & RUSSELL, L.L.C.",101 W RENNER ROAD,RICHARDSON,TX,United States,75082,972-788-4703,HTTPS://TWITTER.COM/TUGGLERUSSELL,11512020,0
"ADVAYA, LLC",ADVAYA INVESTMENT MANAGEMENT,,,,,,415-518-9719,HTTPS://WWW.ADVAYA.COM,11512236,0
"MEETING HOUSE CAPITAL, LLC","MEETING HOUSE CAPITAL, LLC",100 MAIN STREET,CONCORD,MA,United States,01742,978-245-6811,https://www.linkedin.com/company/71325666/admin/,11521988,
"WINCHESTER CAPITAL SERVICES, LLC","WINCHESTER CAPITAL SERVICES, LLC",,,,,,504-723-8400,,11524109,1-10
"CRAWFORD, DENNIS EARL",DIVERSIFIED CONSUMER PLANNING,,,,,,517-456-7732,,11526416,0
"SLATE PEAK FINANCIAL SERVICES, LLC","SLATE PEAK FINANCIAL SERVICES, LLC",,,,,,617-383-4577,https://www.slatepeakfinancial.com/,11528127,51-100
EVIDENCIAL FINANCIAL CONSULTING LLC,EVIDENCIAL FINANCIAL CONSULTING,,,,,,415-902-3632,https://www.linkedin.com/in/kristopher-j-van-stralen-chfc-9a4896a,11530000,1-10
"MOUNTAIN FINANCIAL CAPITAL, LLC",MOUNTAIN FINANCIAL CAPITAL,,,,,,(720) 445-6901,HTTP://WWW.INFO_AT_MTNFINCAPITAL.COM,11539348,1-10
"BERT RIDDELL CRAMER, INVESTMENT ADVISER","BERT RIDDELL CRAMER, INVESTMENT ADVISER",,,,,,610-777-3193,,11540000,0
SHEPTOFF INVESTMENT GROUP LLC,SHEPTOFF INVESTMENT GROUP LLC,,,,,,860-461-9298,HTTP://WWW.SHEPTOFF.COM,11544345,11-25
SIMPLICITY WEALTH MANAGEMENT LLC,SIMPLICITY WEALTH MANAGEMENT,,,,,,(804) 286-4910,https://www.facebook.com/simplicitywealthmanagement/,11548449,26-50
LT ADVISORS LLC,LT ADVISORS LLC,,,,,,(914) 216-1739,,11551753,1-10
HGTURNER ASSOCIATES LLC,HGTURNER ASSOCIATES LLC,,,,,,631-673-3055,,11553930,0
"WAKEFIELD FINANCIAL PLANNING, LLC","WAKEFIELD FINANCIAL PLANNING, LLC",,,,,,919-422-6090,HTTP://WWW.WAKEFIELDFINANCIAL.COM,11559000,1-10
"SINGLE A CAPITAL, LLC","SINGLE A CAPITAL, LLC",,,,,,646-338-1808,HTTPS://WWW.SINGLEACAPITAL.COM,11560000,
"PREMIER WEALTH ADVISORY SERVICES,INC.","PREMIER WEALTH ADVISORY SERVICES, INC.",16100 CHESTERFIELD PKWY WEST,CHESTERFIELD,MO,United States,63017,636-532-7337,https://www.facebook.com/premierwealthadvisoryservices,11566342,51-100
"MARINA WEALTH ADVISORS, LLC",MARINA WEALTH ADVISORS,,,,,,(310) 817-0744,https://www.MarinaWealthAdvisors.com,11567231,1-10
"RANDAZZO CAPITAL MANAGEMENT, LLC","RANDAZZO CAPITAL MANAGEMENT, LLC",,,,,,949-939-1727,http://www.linkedin.com/in/parkrandazzo,11572455,0
"ASSET ACCUMULATION,PROTECTION,PRESERVATION AND TRANSFER, LLC","ASSET ACCUMULATION,PROTECTION,PRESERVATION AND TRANSFER, LLC",,,,,,770-874-0083,HTTP://WWW.APTJAC.COM,11585787,1-10
"MDC FINANCIAL CONSULTING, LLC","MDC FINANCIAL CONSULTING, LLC",,,,,,(201) 666-6838,,11587577,0
BREAKOUT PRIVATE WEALTH LLC,BREAKOUT PRIVATE WEALTH LLC,2700 PATRIOT BLVD.,GLENVIEW,IL,United States,60026,312-953-4081,,11590700,1-10
"LEWER FINANCIAL ADVISORS, LLC","LEWER FINANCIAL ADVISORS, LLC",9900 WEST 109TH STREET,OVERLAND PARK,KS,United States,66210,816-360-7900,https://lewercustomers.com/shaw-flooring/,11590875,26-50
"JOHNEDIS JR., DANIEL J.","CRATUS CAPITAL, LLC",,,,,,954-554-5370,http://cratuscapital.com,11600000,26-50
EPL INVESTMENT ADVISORY LLC,EPL INVESTMENT ADVISORY LLC,3035 S ELLSWORTH ROAD,MESA,AZ,United States,85212,480-831-1731,HTTPS://WWW.EPLIA.COM/,11600000,0
"OFSG, LLC",OLSON WEALTH MANAGEMENT,468 S. SEGUIN AVE.,NEW BRAUNFELS,TX,United States,78130,(210) 860-7338,https://olsonwealthmanagement.com,11603657,11-25
"STRATEGIC WEALTH PARTNERS, LLC","STRATEGIC WEALTH PARTNERS, LLC",,,,,,7192859530,,11608108,1-10
"SPORTS & ENTERTAINMENT INVESTMENT ADVISERS, LLC","SPORTS & ENTERTAINMENT INVESTMENT ADVISERS, LLC",400 RELLA BOULEVARD,MONTEBELLO,NY,United States,10901,845-369-9422,HTTPS://WWW.SEINVESTMENTADVISERS.COM,11608191,
LARIAT WEALTH MANAGEMENT LLC,LARIAT WEALTH MANAGEMENT,8400 E. PRENTICE AVENUE,GREENWOOD VILLAGE,CO,United States,80111,303-506-7739,https://www.linkedin.com/in/maia-babbs-0413495/,11609641,1-10
"STONE HILL WEALTH MANAGEMENT, LLC","STONE HILL WEALTH MANAGEMENT, LLC",2550 PACIFIC AVENUE,DALLAS,TX,United States,75226,(469) 608-1457,HTTP://WWW.LINKEDIN.COM/IN/PHILLIPWASHINGTONJR,11610062,101-250
CM FIRST CAPITAL CORP.,CM FIRST CAPITAL CORP.,18600 MAIN STREET,HUNTINGTON BEACH,CA,United States,92648,714-465-2207,,11612180,
"BLACK ELM ADVISERS, LLC","BLACK ELM ADVISERS, LLC",,,,,,847-676-2590,http://www.blackelmadvisers.com,11621046,
STRATEGIC WEALTH MANAGEMENT LLC,STRATEGIC WEALTH MANAGEMENT LLC,555 PLEASANTVILLE RD,BRIARCLIFF MANOR,NY,United States,10510,9147692601,,11629898,0
EVAN CAPITAL LLC,EVAN CAPITAL,1800 BERING DRIVE,HOUSTON,TX,United States,77057,(713) 322-8920,HTTPS://WWW.EVANCAPITAL.COM/,11631126,0
YOUNG SCRAPPY MONEY LLC,YOUNG & SCRAPPY,520 W. PONCE DE LEON AVE.,DECATUR,GA,United States,30031,(404) 446-9199,http://queerfinancialadvisor.com,11632010,26-50
ENVISION WEALTH PLANNING INC.,ENVISION WEALTH PLANNING INC.,100 S. STATE ST.,CHICAGO,IL,United States,60603,312-448-1010,https://envisionwealth.us/,11637545,51-100
"ASPEN FINANCIAL SOLUTIONS, LLC","ASPEN FINANCIAL SOLUTIONS, LLC",5084 SNOWMASS CREEK ROAD,SNOWMASS,CO,United States,81654,970-274-4346,HTTP://WWW.ASPENFINANCIALSOLUTIONS.COM,11638712,
JOHN VITALE,PALISADES RESEARCH SYSTEMS,,,,,,310-459-7528,HTTP://WWW.STOCMARKET.COM,11640000,0
"ADAP TAX FINANCIAL, INC.","ADAP TAX FINANCIAL, INC.",4725 FIRST STREET,PLEASANTON,CA,United States,94566,925-218-2301,https://www.yelp.com/biz/adap-tax-financial-inc-pleasanton,11642857,11-25
WILLIAM MURRAY RUFFELL,MURRAY RUFFELL,,,,,,904-273-7069,,11644343,0
"BR CAPITAL, INC.","BR CAPITAL, INC.",2005 SE 192ND AVE STE 200,CAMAS,WA,United States,98607-7475,360-735-1900,HTTPS://WWW.LINKEDIN.COM/IN/MICHAEL-ELERATH-095A5114/,11646103,1-10
"STERLING INVESTMENT ADVISOR, INC.",STERLING ADVISOR GROUP,2500 S POWER RD,MESA,AZ,United States,85209,480-729-8000,,11650000,0
"PANTHER FINANCIAL PLANNING, LLC","PANTHER FINANCIAL PLANNING, LLC",,,,,,615-507-2093,HTTPS://WWW.LINKEDIN.COM/IN/CHERYL-PANTHER-122328186/,11651477,51-100
SOUND FINANCIAL SOLUTIONS LLC,SOUND FINANCIAL SOLUTIONS LLC,"1900 S. HARBOR CITY BLVD, SUITE 305",MELBOURNE,FL,United States,32901,321-984-2152,HTTP://WWW.SOUNDFINANCIALSOLUTIONS.NET,11654596,0
"WEALTH MANAGEMENT SERVICES,LLC","WEALTH MANAGEMENT SERVICES,LLC","2 LAWRENCE SQUARE, SUITE B",SPRINGFIELD,IL,United States,62704,217-492-1040,,11654939,0
"BARNETT, DAVID WAYNE",GRAND ARBOR ADVISORS,,,,,,817-589-7281,HTTP://WWW.DAVIDWBARNETT.COM,11662551,26-50
JACOBE INVESTMENTS LLC,JACOBE INVESTMENTS,510 BERING DRIVE,HOUSTON,TX,United States,77057,713-975-7400,,11669257,0
"POLARIS WEALTH MANAGEMENT, LLC","POLARIS WEALTH MANAGEMENT, LLC",,,,,,312-951-2606,http://www.PolarisAdvice.com,11671316,51-100
MORSE GROUP INVESTMENT ADVISORS LLC,MORSE GROUP INVESTMENT ADVISORS,,,,,,213-358-9460,https://www.morse-group.com,11685545,1-10
"RRIM ASSET STRATEGIES, LLC",RRIM ASSET STRATEGIES,,,,,,206-310-2358,,11686172,0
"ARMORY CAPITAL GROUP, LLC","ARMORY CAPITAL GROUP, LLC",200 NORTH PACIFIC COAST HIGHWAY,EL SEGUNDO,CA,United States,90245,310-643-9100,HTTP://WWW.ARMORYCAPITAL.COM,11687477,0
ESG WEALTH ADVISORS LLC,ESG WEALTH ADVISORS,,,,,,2676138406,https://esgwa.com/,11699318,1-10
"TREE FORT FINANCIAL, INC.","TREE FORT FINANCIAL, INC.",,,,,,312-666-7587,https://www.facebook.com/Tree-Fort-Financial-1380637958924005,11700000,26-50
"SPRINCZ ADVISORY GROUP, LLC","SPRINCZ ADVISORY GROUP, LLC",9200 W. CROSS DRIVE,LITTLETON,CO,United States,80123,303-779-1188,HTTP://DONTGOBROKEKIT.COM/,11700000,0
AMERICAN GROWTH CITIES LLC,LAGUNA COAST CAPITAL,,,,,,949-880-5336,http://www.lagunacoastcap.com,11700000,0
"ERICA HALL WEALTH ADVISORS, LLC","ERICA HALL WEALTH ADVISORS, LLC.",2000 TOWN CENTER DRIVE,SOUTHFIELD,MI,United States,48075,313-393-8800,HTTP://WWW.EHWEALTHADVISORS.COM,11701236,51-100
"MONEY POOLE...SOLUTIONS FOR LIFE, LLC","MONEY POOLE...SOLUTIONS FOR LIFE, LLC",,,,,,864-326-5464,HTTP://WWW.MONEYPOOLE.COM,11703293,
"PAGE FINANCIAL SERVICES, LLC","PAGE FINANCIAL SERVICES, LLC",8607 SMYRNA PARKWAY,LOUISVILLE,KY,United States,40228,502-905-4152,,11704416,0
"DAUBLE+WORTHINGTON CAPITAL MANAGEMENT, LLC",DAUBLE+WORTHINGTON EQUITY PORTFOLIOS,,,,,,812-401-8700,HTTPS://WWW.DWEQUITY.COM,11705421,0
2050 WEALTH PARTNERS LLC,2050 WEALTH PARTNERS LLC,"9103 WOODMORE CENTRE DRIVE,",LANHAM,MD,United States,20706,240-406-9181,https://www.linkedin.com/company/2050wps/,11709674,51-100
MISSION PEAK CAPITAL ADVISORS LLC,MISSION PEAK CAPITAL ADVISORS LLC,"300 E 39TH, SUITE 5H",KANSAS CITY,MO,United States,64111,816.994.6600,HTTPS://WWW.MISSIONPEAKCAPITAL.COM,11713124,
"SAPPHIRE FIDUCIARY ADVISORS, LLC","SAPPHIRE FIDUCIARY ADVISORS, LLC",,,,,,502-509-2568,https://www.linkedin.com/company/sapphirefiduciary,11714948,
MICHAEL PAUL O'CONNELL,LINDEN ASH CAPITAL,,,,,,513-703-0553,,11720000,0
RECKER FINANCIAL LLC,RECKER FINANCIAL LLC,122 UPTOWN DRIVE,BAY CITY,MI,United States,48708,989-214-0120,https://www.linkedin.com/in/mark-recker-75654590/,11723818,51-100
"DUKES FINANCIAL GROUP, LLC","DUKES FINANCIAL GROUP, LLC",,,,,,704-957-4101,,11726061,11-25
"HARRIS AND HARRIS WEALTH MANAGEMENT GROUP, LLC","HARRIS AND HARRIS WEALTH MANAGEMENT GROUP, LLC",,,,,,(301) 218-0885,HTTP://WWW.FINANCENSTILETTOS.COM,11739659,1-10
"FINANCIAL DECISION PARTNERS, LLC","FINANCIAL DECISION PARTNERS, LLC",,,,,,770-985-4071,HTTPS://WWW.FDP-PLANNERS.COM,11743837,1-10
"BIRD ROCK MANAGEMENT, LLC","BIRD ROCK MANAGEMENT, LLC",1590 S COAST HWY #16,LAGUNA BEACH,CA,United States,92651,949-715-0900,,11747500,
NUCLO WEALTH LLC,NUCLO WEALTH,609 MAIN ST.,HOUSTON,TX,United States,77002,281 857-6435,HTTP://NUCLOWEALTH.COM,11755573,0
"SIGNATURE INTELLIGENT PORTFOLIOS, LLC","SIGNATURE INTELLIGENT PORTFOLIOS, LLC",2121 AVENUE OF THE STARS,LOS ANGELES,CA,United States,90067,844-839-7353,HTTP://WWW.SIGNATUREPORTFOLIOS.COM,11758908,0
"TROIKA INVESTMENT ADVISORS, LLC","TROIKA INVESTMENT ADVISORS, LLC",,,,,,860-455-0637,,11765573,
GLASS LAKE WEALTH MANAGEMENT LLC,GLASS LAKE WEALTH MANAGEMENT,,,,,,608-347-5558,http://www.glasslakewealth.com,11770000,11-25
"PORTER WEALTH MANAGEMENT, LLC","PORTER WEALTH MANAGEMENT, LLC",691 JOHN WESLEY DOBBS AVE NE,ATLANTA,GA,United States,30312,(540) 270-7542,HTTPS://WWW.LINKEDIN.COM/IN/JUSTINPORTERCFP/,11775694,26-50
"HAWTHORNE FINANCIAL ADVISORS, LLC","HAWTHORNE FINANCIAL ADVISORS, LLC",,,,,,(617) 648-6570,HTTP://WWW.HAWTHORNEFA.COM,11782483,1-10
"INTERVAL CAPITAL MANAGEMENT, LLC","INTERVAL CAPITAL MANAGEMENT, LLC",,,,,,(510) 697-6435,http://www.intervalcm.com,11786000,0
"WESTWOOD ASSET MANAGEMENT, LLC","WESTWOOD ASSET MANAGEMENT, LLC",,,,,,913-362-7771,,11796201,
"THE FINANCIAL ADVANTAGE GROUP, LLC",FINANCIAL ADVANTAGE ADVISORS CO.,,,,,,860-688-8849 X201,HTTP://WWW.FINADVGR.COM,11797589,0
"GRO CAPITAL, LLC","GRO CAPITAL, LLC",63 CORYELL STREET  SUITE A,LAMBERTVILLE,NJ,United States,08530,609-397-6522,,11800000,0
LAZEAR INVESTMENTS,MILE HIGH WEALTH MANAGEMENT,,,,,,720-509-9363,http://www.lazearinvestments.com,11800000,1-10
"L&L FINANCIAL SERVICES, LLP","L&L FINANCIAL SERVICES, LLP",316 BEL AIR BLVD.,MOBILE,AL,United States,36606,251-476-3600,HTTP://WWW.LL-FINANCIAL.COM,11800000,
"BATLEY, KENT MICHAEL",BATLEY & ASSOCIATES,,,,,,503-351-7024,,11800000,
"VODICKA GROUP, INC.","VODICKA GROUP, INC.",,,,,,312-488-1637,https://twitter.com/mikevodicka,11800000,1-10
"KERUSSO CAPITAL MANAGEMENT, LLC","KERUSSO CAPITAL MANAGEMENT, LLC",486 NORTH PATTERSON AVENUE,WINSTON-SALEM,NC,United States,27101,404-226-2537,https://www.kerussocapital.com,11812598,
FAIRPORT ASSET MANAGEMENT CORP,FAIRPORT ASSET MANAGEMENT CORP,1515 BLACK ROCK TURNPIKE,FAIRFIELD,CT,United States,06825,203-335-0344,HTTP://WWW.FAIRPORTSERVICES.COM,11812729,1-10
JACK DONALD BECKER,BECKER CAPITAL MANAGEMENT,,,,,,214-823-6412,,11813209,0
"WENTSEL WEALTH MANAGEMENT, LLC","WENTSEL WEALTH MANAGEMENT, LLC",,,,,,708-712-0392,https://www.linkedin.com/company/wentsel-wealth-management-llc/,11815630,1-10
STONEHAVEN PRIVATE WEALTH MANAGEMENT LLC,STONEHAVEN PRIVATE WEALTH MANAGEMENT LLC,,,,,,978-430-0150,HTTP://WWW.STONEHAVENWEALTHMANAGEMENT.COM,11817008,0
WILLIAM CECIL BOWERS JR.,BOWERS CAPITAL MANAGEMENT,,,,,,812-951-0380,HTTP://WWW.BOWERSCAPITAL.COM,11822887,0
FAUBION WEALTH MANAGEMENT LLC,FAUBION WEALTH MANAGEMENT LLC,,,,,,(925) 322-2450,https://thewealtheffect.buzzsprout.com/,11831348,26-50
"CARRINGTON FINANCIAL PLANNING, LLC","CARRINGTON FINANCIAL PLANNING, LLC",,,,,,(305) 209-4724,https://www.facebook.com/carringtonfp/,11832000,101-250
"HARMON FINANCIAL ADVISORS, INC.","HARMON FINANCIAL ADVISORS, INC.",10 CANEBRAKE BLVD.,FLOWOOD,MS,United States,39232,601-955-7554,HTTP://WWW.HARMONFA.COM,11842445,0
"PONDEROSA INVESTMENT GROUP, LLC","PONDEROSA INVESTMENT GROUP, LLC",,,,,,503-286-0005,HTTP://WWW.PONDEROSAIG.COM,11846109,0
"AJP FINANCIAL SERVICES, LLC","AJP FINANCIAL SERVICES, LLC",,,,,,302-654-3100,,11855530,1-10
"VISIONARY PLANNING & INVESTMENT, LLC","VISIONARY PLANNING & INVESTMENT, LLC",,,,,,(720) 210-4990,HTTPS://VISIONARYPLANNINGANDINVESTMENT.COM,11860450,51-100
"GREEN STREET WEALTH ADVISORY, LLC","GREEN STREET WEALTH ADVISORY, LLC",70 ROMANO VINEYARD WAY,NORTH KINGSTON,RI,United States,02852,401-294-7200,http://www.greenstreetwealth.com,11876233,
"SCT WEALTH MANAGEMENT, LLC","SCT WEALTH MANAGEMENT, LLC",,,,,,623-777-3585,HTTP://WWW.SCTWEALTH.COM,11877610,0
GP ANALYTICS LLC,GP ANALYTICS,1005 A ST.,SAN RAFAEL,CA,United States,94901,415-793-5791,HTTP://WWW.GPANALYTICS.NET,11880408,0
"KELLY & ASSOCIATES, LLC","KELLY & ASSOCIATES, LLC",,,,,,561-707-0552,,11884889,
"ASPIRE WEALTH ADVISORY, LLC",ASPIRE WEALTH,5659 N KRAFT LAKE DR,CALEDONIA,MI,United States,49316,616-828-3803,HTTPS://WWW.ASPIREWEALTHADVISORY.COM,11887185,11-25
"MILESTONE CONSULTANTS, INC.","MILESTONE CONSULTANTS, INC.",,,,,,585-228-2558,HTTP://WWW.LINKEDIN.COM/COMPANY/MILESTONECONSULTANTSINC/,11889000,0
"CMA FINANCIAL SERVICES, LLC",CMA FINANCIAL SERVICES,"1 DUNWOODY PARK, S",ATLANTA,GA,United States,30338,770-493-7578,HTTP://WWW.CMAWIZARDS.COM,11890589,26-50
"CLARK, GARY WILLARD",CLARK PLANNING & INVESTMENT ADVISORY,1900 PROVIDENCE PARK,BIRMINGHAM,AL,United States,35242,205-981-1120,HTTP://WWW.CLARKPLANNING.COM,11891648,1-10
"NELSON, ALEXANDER BRICE","BRICE FINANCIAL SERVICES, INC.",2000 NORTH BAYSHORE DRIVE,MIAMI,FL,United States,33137,(305)967-8390,,11892560,251-500
"STERN, MICHAEL WARREN",ARLINGTON INVESTMENT ADVISORS,,,,,,781-355-6880,HTTPS://WWW.ARLINGTONINVEST.COM,11900000,1-10
FORTUNA CAPITAL ADVISORS LLC,FORTUNA CAPITAL ADVISORS LLC,403 BOXWOOD ROAD,BRYN MAWR,PA,United States,19010,888-422-2477,HTTP://WWW.MYFCAP.COM,11900000,0
R.J. SUTTS & COMPANY,R.J. SUTTS & COMPANY,,,,,,586-246-1817,,11900000,0
GOGGANS GROUP INC,GOGGANS GROUP INC,612 BROAD ST,GADSDEN,AL,United States,35901-3775,844-464-4267,HTTPS://TWITTER.COM/GOGGANSGROUP,11900000,1-10
"MARBLEHEAD CAPITAL, LLC","MARBLEHEAD CAPITAL, LLC",100 CUMMINGS CENTER,BEVERLY,MA,United States,01915,978-969-2468,,11900000,
"BARAC CAPITAL MANAGEMENT, LLC","BARAC CAPITAL MANAGEMENT, LLC","7000 NORTH MOPAC EXPRESSWAY, SUITE 200",AUSTIN,TX,United States,78731,512-981-8080,https://www.linkedin.com/company/baraccapitalmanagement,11900000,11-25
SWARTZ ADVISORY LLC,SWARTZ ADVISORY LLC,,,,,,224-334-9271,,11900000,0
"SZAFRAN CAPITAL MANAGEMENT, LLC","SZAFRAN CAPITAL MANAGEMENT, LLC",,,,,,214-293-4850,,11906428,11-25
KCPAG FINANCIAL ADVISORS LLC,KCPAG FINANCIAL ADVISORS LLC,1619 W. MAIN STREET,ROBINSON,IL,United States,62454,618-544-4993,HTTP://WWW.KEMPERCAPITALMANAGEMENT.COM,11925521,51-100
"MIGH FINANCIAL PLANNER, LLC","MIGH FINANCIAL PLANNER, LLC",,,,,,(408) 353-2668,,11930000,1-10
BOLGIANO FINANCIAL LLC,BOLGIANO CAPITAL MANAGEMENT,525 E MAIN STREET,MIDLOTHIAN,TX,United States,76065,972-723-5200,HTTP://WWW.BOLGIANOTAX.COM/,11938502,0
COMMON WEALTH MANAGEMENT LLC,COMMON WEALTH MANAGEMENT LLC,6816 CAINE ROAD,COLUMBUS,OH,United States,43015,740-417-4160,,11939087,0
"MAYNARD FINANCIAL SERVICES, LLC","MAYNARD FINANCIAL SERVICES, LLC",,,,,,530-520-6030,,11946842,
"KICKPOINT FINANCIAL, LLC","KICKPOINT FINANCIAL, LLC",3730 KIRBY DRIVE,HOUSTON,TX,United States,77098,713-834-1103,http://www.kickpointfinancial.com,11947806,
HONEST WEALTH LLC,HONEST WEALTH LLC,9841 IRVINE CENTER DRIVE,IRVINE,CA,United States,92618,949-346-6854,,11949545,0
CARTER & BALSAM ADVISERS,CARTER & BALSAM ADVISERS,825 S GRETNA GREEN WAY # K,LOS ANGELES,CA,United States,90049-5230,310-979-5925,HTTPS://WWW.CARTERBALSAMADVISERS.COM,11954130,0
GRAY INVESTMENT MANAGEMENT LLC,GRAY INVESTMENT MANAGEMENT LLC,,,,,,484-947-6429,https://Twitter.com : @InvestmentsGray,11971108,0
IMPACT FI LLC,IMPACTFI,,,,,,415-907-7112,http://www.impact-fi.com/,11972301,1-10
INCEPTION FINANCIAL SERVICES,INCEPTION FINANCIAL SERVICES,17822 17TH STREET,TUSTIN,CA,United States,92780,714-543-5900,https://www.inceptionfs.com,11973555,0
"MT FINANCIAL PLANNING, INC.",MT FINANCIAL PLANNING,5067 SHORELINE RD,LAKE BARRINGTON,IL,United States,60010,(847)860-6050,https://www.facebook.com/MT-Financial-Planning-104356324636804,11974793,1-10
"SECONDHALF PLANNING & INVESTMENT, LLC","SECONDHALF PLANNING & INVESTMENT, LLC",,,,,,503-343-9860,https://SECONDHALFPLANNING.COM,11975000,1-10
MARKETCIPHER PARTNERS LLC,MARKETCIPHER PARTNERS LLC,818 A1A NORTH,PONTE VEDRA BEACH,FL,United States,32082,904-395-3567,http://www.market-cipher.com/,11984715,
"CENACLE CAPITAL MANAGEMENT, LLC","CENACLE CAPITAL MANAGEMENT, LLC",,,,,,847-686-4800,HTTP://WWW.CENACLECAPITAL.COM,11987874,
"HENNESSY, BRIAN GARRETT",HENNESSY FINANCIAL SERVICES,,,,,,617-852-4707,,11992339,0
BWM LLC,BWM LLC,,,,,,847-828-6389,,11993710,0
"FINANCIAL FACILITATORS, INC.","FINANCIAL FACILITATORS, INC.",450 COUNTRY CLUB ROAD,EUGENE,OR,United States,97401,541-485-7254,,11994000,26-50
KODA WEALTH MANAGEMENT LLC,KODA WEALTH MANAGEMENT,2658 INDUSTRIAL BLVD,ABILENE,TX,United States,79605,325-695-9999,,11995070,0
"RHJ FINANCIAL, INC.","RHJ FINANCIAL, INC.",,,,,,972-359-1280,,11996184,
"FAMILY INVESTMENT PLANNING, LLC","FAMILY INVESTMENT PLANNING, LLC",925 ELM GROVE ROAD,ELM GROVE,WI,United States,53122,414-435-0601,HTTP://WWW.FAMILYINVESTMENTPLANNING.COM,12000000,26-50
LARREA WEALTH MANAGEMENT,LARREA WEALTH MANAGEMENT,165 BROADWAY  23 FLOOR,NEW YORK,NY,United States,10006,2123908918,HTTP://WWW.LARREAWEALTH.COM,12000000,1-10
"HARVEST CAPITAL MANAGEMENT, LLC","HARVEST CAPITAL MANAGEMENT, LLC",1212 HANCOCK STREET,QUINCY,MA,United States,02169,(617) 413-5884,,12000000,0
HYNES ADVISORY GROUP LLC,HYNES ADVISORY GROUP LLC,9920 WATSON ROAD,ST LOUIS,MO,United States,63126,314-858-1335,HTTP://WWW.ROBERTEHYNES.COM,12000000,51-100
WALLACE INVESTMENTS,WALLACE INVESTMENTS,14 WALL STREET 20TH FLOOR,NEW YORK,NY,United States,10005,917-916-9545,https://www.wallaceinvestment.com,12000000,1-10
"CALIBRATE WEALTH, LLC","CALIBRATE WEALTH, LLC",,,,,,(773) 501-4965,HTTPS://LINKEDIN.COM/IN/ZACHARY-MARSH-567A6068,12000000,11-25
"EQUITY LOGIC, LLC",EQUITY LOGIC,,,,,,415-999-9033,HTTP://WWW.EQUITYLOGIC.NET,12000000,
RD KELLEY FINANCIAL GROUP,RD KELLEY FINANCIAL GROUP,,,,,,520-904-7241,https://rdkelleyfinancial.com,12000000,1-10
"EVERETT WEALTH SOLUTIONS, INC","EVERETT WEALTH SOLUTIONS, INC",407 MARENGO AVENUE,FOREST PARK,IL,United States,60130-1707,708-771-7777,https://www.facebook.com/everettwealthsolutions,12000000,51-100
"TRUE LIFE WEALTH MANAGEMENT, LLC","TRUE LIFE WEALTH MANAGEMENT, LLC",777 S HARBOUR ISLAND BLVD,TAMPA,FL,United States,33602,800-683-7343,https://www.facebook.com/people/alex-skijus-retirement-planning-specialist/100063761551757/,12000000,51-100
OAKWOOD WEALTH ADVISORS LTD.,OAKWOOD WEALTH ADVISORS LTD.,,,,,,630-560-1500,HTTP://WWW.OAKWOODWEALTHADVISORS.COM,12000000,11-25
CLEARWEALTH,CLEARWEALTH,,,,,,(319) 572-0581,https://www.instagram.com/planwithclearwealth/,12000000,101-250
"HOWLETT FINANCIAL & TAX SERVICES, INC","HOWLETT FINANCIAL & TAX SERVICES, INC",,,,,,408-532-0604,,12000000,
"ANTHONY CAPITAL, LLC","ANTHONY CAPITAL, LLC","11001 WEST 120TH AVE, #400",BROOMFIELD,CO,United States,80021,303-734-7178,http://www.theretirementincomeshow.com,12000000,26-50
"FREEDOM CAPITAL MANAGEMENT, INC.","FREEDOM CAPITAL MANAGEMENT, INC.",,,,,,415-236-5364,HTTP://WWW.FREEDOMCAPITALMANAGEMENT.COM,12000000,0
BLAIR INVESTMENTS LLC,BLAIR INVESTMENTS LLC,420 NE 28TH AVE,PORTLAND,OR,United States,97232,206-601-5113,HTTP://WWW.BLAIRINVESTMENTS.COM,12000000,0
"ALDEN FINANCIAL MANAGEMENT SERVICES, INC.","ALDEN FINANCIAL MANAGEMENT SERVICES, INC.",,,,,,720-775-7954,,12000000,11-25
"BIEHL, DAVID BERNARD",CAPITAL MANAGEMENT SERVICES,,,,,,805-452-1867,,12000000,1-10
"VAUGHAN INVESTMENT ADVISORS, LLC","VAUGHAN INVESTMENT ADVISORS, LLC",110 E. WILSON BRIDGE ROAD,WORTHINGTON,OH,United States,43085,614-296-3974,https://viadvisorsllc.com/,12000000,
"LINIAM CAPITAL, LLC","LINIAM CAPITAL, LLC",,,,,,612-760-2321,https://www.liniam.com/,12000000,11-25
LAA PARTNERS LLC,LAA PARTNERS,7777 GLADES ROAD,BOCA RATON,FL,United States,33434,201-873-2664,HTTPS://WWW.LAAPARTNERS.COM/,12000000,0
"METIS ASSET MANAGEMENT ADVISORY, LLC","METIS ASSET MANAGEMENT ADVISORY, LLC",,,,,,847-912-9781,,12000000,51-100
MIGHTY OAK MANAGEMENT LLC,MIGHTY OAK MANAGEMENT LLC,,,,,,203-964-9300,,12000000,1-10
INCREASE CONSULTANTS LLC,INCREASE CONSULTANTS LLC,"7335 HIGHWAY 6,",MISSOURI CITY,TX,United States,77459,281-778-8161,HTTP://WWW.INC-FINANCIAL.COM,12000000,1-10
"PROSPERITY INVESTMENT ADVISORS, INC.","PROSPERITY INVESTMENT ADVISORS, INC.",,,,,,303-776-4562,HTTP://PROSPERITYIA.COM,12000000,1-10
"JOHN DANIELS CPA, LLC","JOHN DANIELS CPA, LLC",5902 TIDEWOOD AVE,SARASOTA,FL,United States,34231,941-284-8511,https://www.johndanielscpa.com,12000000,1-10
"TRINGLE JR., JOHN R.","TRINGLE JR., JOHN R.",,,,,,(212) 995-2172,,12000000,
"RAYMON CAPITAL ADVISORS, LLC","RAYMON CAPITAL ADVISORS, LLC",,,,,,404-219-1265,,12000000,0
"THREE CIRCLES CAPITAL MANAGEMENT, LLC","THREE CIRCLES CAPITAL MANAGEMENT, LLC",1550 LARIMER STREET #640,DENVER,CO,United States,80202,720-936-1570,HTTP://THREECIRCLESCAPITAL.COM/,12000000,0
"CB3 FINANCIAL GROUP, INC.","CB3 FINANCIAL GROUP, INC.",,,,,,3125137486,HTTP://WWW.CB3FINANCIAL.COM,12000000,
RWF WEALTH MANAGEMENT LLC,RWF WEALTH MANAGEMENT LLC,,,,,,239-293-9031,,12000000,
"PREMIER INVESTMENT MANAGEMENT, LLC","PREMIER INVESTMENT MANAGEMENT, LLC",,,,,,385-259-3568,http://mypimconnect.com,12000000,1-10
"ATHOS CAPITAL ADVISORS, LLC",ATHOS CAPITAL ADVISORS,,,,,,310-971-4765,http://www.athoscapitaladvisors.com,12000000,26-50
GREAT LIFE INVESTING LLC,GREAT LIFE INVESTING,4424 6TH AVE,TACOMA,WA,United States,98406,253-858-2427,http://www.greatlifeinvesting.com,12000000,1-10
BLACK CAT WEALTH LLC,BLACK CAT WEALTH,612 W BEALL STREET,BOZEMAN,MT,United States,59715-3427,406-587-5587,,12000000,1-10
"MU, PETER, SIZHONG",WEALTH CAIRN,,,,,,408-520-1518,https://www.wealthcairn.com,12000000,1-10
