LegalNm,BusNm,Address,City,State,Country,Zipcode,Phone_Number,Website,Total_Assets,Clients
"THE FREEDOM EXPERIENCE, INC.","THE FREEDOM EXPERIENCE, INC.",,,,,,847-579-9675,https://www.linkedin.com/in/chadtennant/,10000375,0
"INFINITY WEALTHCARE, LLC","INFINITY WEALTHCARE, LLC",,,,,,718-360-3954,http://www.infinitywealthcare.com,10003376,1-10
BRSQUARED L.L.C.,BRSQUARED L.L.C.,,,,,,408-674-7292,https://linkedin.com/in/rachna-bijlani-cfp®-191430103,10004818,1-10
A B L E WEALTH MANAGEMENT SOLUTIONS LLC,A B L E WEALTH MANAGEMENT SOLUTIONS LLC,3380 TRAVIS POINTE ROAD,ANN ARBOR,MI,United States,48108,734-786-3875,http://www.ablewms.com/,10010665,0
"YOUNG, GUY CAMERON",YOUNG FINANCIAL & INSURANCE SERVICES,,,,,,(650)652-9150,HTTP://WWW.YOUNGFINANCIAL.COM,10013000,0
"PEARL, AMY",ACORN FINANCIAL PLANNING,,,,,,650-279-1010,HTTP://WWW.ACORNFP.COM,10015000,1-10
BULL & BEAR ADVISORS LLC,BULL & BEAR ADVISORS LLC,,,,,,813-318-2537,https://bull-bear.com,10017471,
HIGHGATE FINANCIAL PARTNERS LLC,HIGHGATE FINANCIAL PARTNERS,32107 LINDERO CANYON ROAD,WESTLAKE VILLAGE,CA,United States,91361,818-699-6277,https://www.linkedin.com/in/jeff-pippin-35624512,10021005,1-10
ANTONIO STEVEN ANDRADE,"ANTONIO ANDRADE, CFP",401 WEST MILL STREET,UKIAH,CA,United States,95482-5435,707-462-4930,,10034206,11-25
"MONMOUTH INVESTMENT ADVISORS, LLC","MONMOUTH INVESTMENT ADVISORS, LLC",,,,,,(732)224-0151,,10037827,1-10
"PERSONAL BUSINESS MANAGEMENT SERVICES, LLC.","PERSONAL BUSINESS MANAGEMENT SERVICES, LLC.",,,,,,954-594-0691,,10039987,11-25
"MAIN STREET WEALTH MANAGEMENT, LLC","MAIN STREET WEALTH MANAGEMENT, LLC",,,,,,315-516-8052,https://www.mainstwm.com,10040064,1-10
MERAKI ADVISORS LLC,MERAKI ADVISORS LLC,1901 N AKARD ST.,DALLAS,TX,United States,75201,214-206-5198,,10041049,0
NESHAMINY CREEK FINANCIAL ADVISORY CORP.,NESHAMINY CREEK ADVISORS,,,,,,215-962-3744,https://www.facebook.com/NeshaminyCreekAdvisors/?ref=aymt_homepage_panel&eid=ARAKyJh3MwIhelpeQGXr0KwGZxDxQBw7pAFkglCwPAmxYVSKzRl,10043623,0
"MIDWEST CAPITAL FINANCIAL ADVISORS, LLC","MIDWEST CAPITAL FINANCIAL ADVISORS, LLC",226 N 12TH ST,DECATUR,IN,United States,46733,260-724-4472,http://midwestcapital.net/,10051159,0
ECHO PRUDENT CAPITAL LLC,ECHO PRUDENT CAPITAL LLC,,,,,,(312) 547-9102,,10053000,0
"MADISON MONEY MANAGEMENT, INC.","MADISON MONEY MANAGEMENT, INC.",,,,,,914-271-4011,,10058000,
"WISDOM INVESTMENT STRATEGIES, LLC","WISDOM INVESTMENT STRATEGIES, LLC",,,,,,440-435-9010,HTTP://WWW.WISDOMISLLC.COM,10071748,1-10
SAFEWATER INVESTMENT MANAGEMENT LLC,SAFEWATER INVESTMENT MANAGEMENT LLC,,,,,,678-640-4595,,10073200,11-25
"STRIVENT FINANCIAL, LLC",STRIVENT FINANCIAL,,,,,,800-893-6783,http://www.striventfinancial.com/,10076906,26-50
DLW PLANNING INC.,DLW PLANNING INC.,,,,,,309-825-6949,HTTP://WWW.DLWPLANNING.COM,10087156,0
"CROPSEY ASSET MANAGEMENT, LLC","CROPSEY ASSET MANAGEMENT, LLC",,,,,,203-665-6431,HTTP://WWW.CROPSEYAM.COM,10092627,
"CRIS CAPITAL, LTD.","CRIS CAPITAL, LTD.",810 S MASON RD,KATY,TX,United States,77450,281-665-3081,https://www.criscapital.com/,10095595,
"RIDLEY ASSET MANAGEMENT, LLC","RIDLEY ASSET MANAGEMENT, LLC",,,,,,415-381-5583,HTTPS://WWW.RIDLEYASSET.COM,10099261,
"FENDZ ASSET MANAGEMENT, INC.","FENDZ ASSET MANAGEMENT, INC.",2997 DAY AVENUE,COCUNUT GROVE,FL,United States,33133,305-562-1944,HTTP://WWW.FENDZUSA.COM,10100000,1-10
CHURCH ORGANIZERS FOUNDATION,CHURCH ORGANIZERS FOUNDATION,,,,,,517-755-8770,http://www.churchorganizers.org/,10100000,1-10
"SMEAC FINANCIAL, LLC","SMEAC FINANCIAL, LLC",,,,,,615-385-7184,HTTPS://SMEACFINANCIAL.COM/,10100000,0
COCHRAN WEALTH LLC,COCHRAN WEALTH LLC,,,,,,404-844-8325,HTTP://WWW.COCHRANWEALTH.COM,10100954,11-25
WILSON HOLDINGS LLC,WILSON FINANCIAL ADVISORY SERVICES,107 N CHAUNCEY ST,COLUMBIA CITY,IN,United States,46725,260-450-1942,,10110000,
"PETERSON, LEE, LOUIS",PETERSON FINANCIAL SERVICES,,,,,,(760) 845-7253,,10131796,0
"GASKIN, HARRY THOMAS","G, G, & M  FINANCIAL GOALS",,,,,,703-549-5208,,10134400,11-25
FINANCIAL SPECTRUM INC.,FINANCIAL SPECTRUM INC.,800 WEST AVENUE,JENKINTOWN,PA,United States,19046-2831,215-659-5723,http://www.FinancialSpectrum.com,10140000,1-10
VANDEBERG ASSOCIATES LLC,VANDEBERG ASSOCIATES LLC,,,,,,608-827-2933,,10140000,0
NEWAGE ADVISORS LLC,NEWAGE ADVISORS LLC,120 N. WASHINGTON SQUARE,LANSING,MI,United States,48933,(517) 618-9558,HTTP://WWW.NEWAGEADVISORS.COM,10141777,26-50
SUPREME ALLIANCE LLC,SUPREME ALLIANCE LLC,,,,,,561-460-2870,HTTP://WWW.SUPREMEALLIANCELLC.COM,10150600,51-100
KRS TAX & INVESTMENTS INC.,KRS TAX & INVESTMENTS INC.,,,,,,650-336-3444,HTTPS://KRSINVEST.NET,10162000,0
"PLANVESTING, LLC","PLANVESTING, LLC",,,,,,810-923-0165,HTTP://WWW.PLANVESTING.COM,10163678,0
PARKMOUNT FINANCIAL PARTNERS LLC,PARKMOUNT FINANCIAL PARTNERS LLC,,,,,,978-846-0665,HTTPS://WWW.PARKMOUNTFINANCIAL.COM,10165349,0
PARKMOUNT FINANCIAL PARTNERS LLC,PARKMOUNT FINANCIAL PARTNERS LLC,,,,,,978-846-0665,HTTPS://WWW.PARKMOUNTFINANCIAL.COM,10165349,0
R.M. DUNCAN CAPITAL MANAGEMENT CORPORATION,R.M. DUNCAN CAPITAL MANAGEMENT CORPORATION,10201 W MARKHAM ST,LITTLE ROCK,AR,United States,72205,501-280-0200,,10166114,
"MCCURDY, GILLION & ASSOCIATES, LLC","MCCURDY, GILLION & ASSOCIATES, LLC",189 SOUTH ORANGE AVENUE,ORLANDO,FL,United States,32801,407-902-2852,,10171994,0
"ARETI CAPITAL ADVISORS, LLC","ARETI CAPITAL ADVISORS, LLC",888 EAST LAS OLAS BLVD,FORT LAUDERDALE,FL,United States,33301,305-904-0156,https://aretiadvisors.com/,10173624,
"MKG CAPITAL MANAGEMENT, LLC","MKG CAPITAL MANAGEMENT, LLC",,,,,,415-282-7902,HTTP://WWW.MKGCAPITAL.COM,10178800,1-10
"ALL WEATHER PORTFOLIO MANAGEMENT, INC.","ALL WEATHER PORTFOLIO MANAGEMENT, INC.",23276 SOUTH POINTE DR,LAGUNA HILLS,CA,United States,92653,949-586-2999,,10190290,11-25
"ZYKOFSKY, STEPHEN MARK","ZYKOFSKY, STEPHEN MARK",,,,,,781-593-9250,,10191176,0
"EMERGENT GLOBAL INVESTMENTS, LLC",EMERGENT GLOBAL INVESTMENTS,"2525 PONCE DE LEON BLVD, STE 300",CORAL GABLES,FL,United States,33134,305-497-8243,https://www.linkedin.com/in/cesarmurillocima/,10197322,0
"OAK TREE WEALTH MANAGEMENT, LLC",OAK TREE WEALTH MANAGEMENT,101 N. SHORELINE BLVD.,CORPUS CHRISTI,TX,United States,78401,361-452-0226,HTTPS://WWW.OTWM.NET,10200000,0
"FERRY CAPITAL MANAGEMENT, LLC",FERRY CAPITAL MANAGEMENT LLC,,,,,,612-327-0768,,10200000,0
"JS ALAN, LLC","JS ALAN, LLC",468 N. CAMDEN DR.,BEVERLY HILLS,CA,United States,90210,310-858-5533,,10200000,0
"COLUMBIA STRATEGIC WEALTH ADVISORS, LLC","COLUMBIA STRATEGIC WEALTH ADVISORS, LLC",9030 35TH AVENUE SW,SEATTLE,WA,United States,98126,206-701-9196,https://www.columbiaswa.com/,10200000,0
"LIFEWATER WEALTH MANAGEMENT, LLC",LIFEWATER WEALTH MANAGEMENT,2180 SATELLITE BLVD,DULUTH,GA,United States,30097,770-800-8432,https://www.lifewaterwealthmanagement.com,10215468,1-10
"CAMBRIA CAPITAL, LLC",CAMBRIA CAPITAL LLC,488 E. WINCHESTER STREET,SALT LAKE CITY,UT,United States,84107,801-320-9606,HTTP://WWW.CAMBRIACAPITAL.COM,10218301,0
"H.I.T. INVESTMENTS, LLC","H.I.T. CAPITAL, LLC",,,,,,309-253-7887,HTTPS://WWW.HITINVESTMENTSLLC.COM,10220000,0
"ENCORE INVESTMENT ADVISORS, LLC","ENCORE INVESTMENT ADVISORS, LLC",,,,,,(508) 504-7155 EXT: 800,https://encoreia.com,10222785,1-10
"1294 MONTGOMERY, LLC",WESTWARD PLANNING GROUP,,,,,,610-529-2211,https://www.facebook.com/westwardplans,10225600,11-25
"LIFECRAFT FINANCIAL PLANNING, LLC","LIFECRAFT FINANCIAL PLANNING, LLC",4325 COMMERCE ST,EUGENE,OR,United States,97402,949-287-1621,https://www.lifecraftfp.com,10228892,1-10
"GADIRAJU, RAJU","GADIRAJU, RAJU",,,,,,972-758-7983,https://www.linkedin.com/in/raju-g-1731021/,10229390,
TEMA GLOBAL LIMITED,TEMA GLOBAL LIMITED,"2ND FLOOR, THE LE GALLAIS BUILDING","ST. HELIER, JERSEY",,Jersey,JE1 1FW,447948254411,https://dawnglobal.com/,10230000,
SHANNON INVESTMENT MANAGEMENT LLC,SHANNON INVESTMENT MANAGEMENT,,,,,,508-468-8397,HTTP://WWW.SHANNONINVESTMENT.COM,10235968,
RIMAR CAPITAL LLC,RIMAR CAPITAL LLC,,,,,,442-777-3730,https://www.instagram.com/rimarcapital/?hl=en,10238136,
BENCHMARK CAPITAL MANAGEMENT CORPORATION,BENCHMARK CAPITAL MANAGEMENT CORPORATION,386 STATE STREET,PORTSMOUTH,NH,United States,03801,603-433-1984,,10240779,
"HARVESTER WEALTH, LLC","HARVESTER WEALTH, LLC",6301 GASTON AVENUE,DALLAS,TX,United States,75214,(214) 210-5860,https://harvesterwealth.com,10242586,1-10
VASSALOTTI INVESTMENT MANAGEMENT CORPORATION,VIMCOR,1409 3RD AVE,DUNCANSVILLE,PA,United States,16635,814-693-5093,HTTPS://WWW.VIMCOR.COM,10250000,0
"MMI ASSET MANAGEMENT SERVICES, LLC","MMI FINANCIAL GROUP, INC.","120 W. EXCHANGE STREET, SUITE 103A",OWOSSO,MI,United States,48867,989-725-9878,HTTP://WWW.MMIFINANCIALGROUP.COM,10254685,1-10
LIFE UNLOCKED PARTNERS LLC,LIFE UNLOCKED PARTNERS LLC,,,,,,888-278-2080,https://www.lifeunlocked.partners,10255618,11-25
"ABG FINANCIAL SERVICES, INC.","ABG FINANCIAL SERVICES, INC.",3043 RIVERSTONE TRAIL,ATLANTA,GA,United States,30339,888-463-0440,HTTP://WWW.LINKEDIN/WTPARKERWEALTH,10271822,11-25
THE CASCADIA GROUP LLC,CASCADIA INVESTMENT CONSULTANTS,1600 VALLEY RIVER DRIVE,EUGENE,OR,United States,97401-2129,541-686-6164,HTTP://WWW.CASCADIACONSULTANTS.COM,10272006,11-25
"RED ROCK CAPITAL ADVISORS, LLC","RED ROCK CAPITAL ADVISORS, LLC",,,,,,218-262-3638,HTTP://WWW.REDROCKCAPITALADVISORS.COM,10272496,0
"BRIDGETOWN FINANCIAL GROUP, LLC","BRIDGETOWN FINANCIAL GROUP, LLC",,,,,,503-730-4673,HTTP://WWW.BRIDGETOWNFINANCIALGROUP.COM,10276259,11-25
"CHARTERED FINANCIAL SERVICES, INC.",MONEYGROW.COM ®,,,,,,404-245-7900,HTTP://WWW.MONEYGROW.COM,10277905,1-10
"HOLYOAK WEALTH MANAGEMENT, LLC","HOLYOAK WEALTH MANAGEMENT, LLC",,,,,,480-227-5458,,10278880,51-100
"FARRAR WEALTH MANAGEMENT, LLC","FARRAR WEALTH MANAGEMENT, LLC",,,,,,561-635-7846,,10282553,1-10
DERIGO CAPITAL MANAGEMENT LLC,DERIGO CAPITAL,,,,,,510-646-3282,http://www.derigocapital.com,10290000,
"YOUR BEST PATH, LLC","YOUR BEST PATH, LLC",,,,,,703-573-7325,https://www.facebook.com/YourBestPathFP,10292723,26-50
"FIRST FINANCIAL SECURITY, LLC","FIRST FINANCIAL SECURITY, LLC",,,,,,610-220-7151,https://www.linkedin.com/in/w-john-mccartin-4203624,10297000,
FOCUS ASSET MANAGEMENT LLC,FOCUS ASSET MANAGEMENT LLC,555 MADISON AVENUE,NEW YORK,NY,United States,10022,646-484-8804,,10298600,11-25
"AMES CAPITAL MANAGEMENT, INC.","AMES CAPITAL MANAGEMENT, INC.",,,,,,941-378-5000,HTTP://WWW.AMESCAPITALMANAGEMENT.COM,10300000,
"LAJALA, STEPHEN EDWARD",LAJALA & ASSOCIATES,1999 S. BASCOM AVE. #1010,CAMPBELL,CA,United States,95008,408-371-9183,HTTP://WWW.LAJALA.COM,10300000,
"WYNSTONE INVESTMENT ADVISORS, LLC.","WYNSTONE INVESTMENT ADVISORS, LLC.",,,,,,847-846-8200,,10300000,1-10
"MARIPOSA CAPITAL MANAGEMENT, LLC","MARIPOSA CAPITAL MANAGEMENT, LLC",251 S LAKE AVE,PASADENA,CA,United States,91101,323-393-0250,HTTP://WWW.MARIPOSACAP.COM,10300000,
"DOUBLE EAGLE PARTNERS, LLC","DOUBLE EAGLE PARTNERS, LLC",,,,,,704-472-8488,https://www.linkedin.com/company/double-eagle-partners/about/?viewAsMember=true,10301078,
"CARDINAL FINANCIAL CONSULTANTS, LLC","CARDINAL FINANCIAL CONSULTANTS, LLC",4295 OKEMOS RD. #120,OKEMOS,MI,United States,48864,5172300082,http://cardinalfinancialconsultants.com,10302000,0
RETIREMENT CAPITAL SERVICES LLC,RETIREMENT CAPITAL SERVICES LLC,8273 S. SAGINAW ST,GRAND BLANC,MI,United States,48439,248-978-5010,https://retirementcap.com,10307000,0
"TEN ELMS FINANCIAL, LLC","TEN ELMS FINANCIAL, LLC",,,,,,713-660-6660,HTTP://WWW.TENELMS.COM/,10315013,1-10
"CRAWFORD ADVISORY GROUP, LLC","CRAWFORD ADVISORY GROUP, LLC",9442 N CAPITAL OF TEXAS HWY,AUSTIN,TX,United States,78759,512-218-9202,HTTP://WWW.CRAWFORDADVISORY.COM,10315632,1-10
"BILL TASKER, INC.","RETIREMENT INCOME MANAGEMENT, INC.",27475 FERRY ROAD,WARRENVILLE,IL,United States,60555,630-717-2909,HTTP://WWW.RIMCO.NET,10315998,0
"ROSS, DAVID LLOYD",ROSS FINANCIAL GROUP,,,,,,562-438-1000,https://rossfg.com/,10320223,0
LAIRD - ALTMAN HOLDINGS LLC,LAIRD - ALTMAN HOLDINGS LLC,,,,,,646-330-5778,,10323509,
BEVERLY HILLS CAPITAL MANAGEMENT LLC,BEVERLY HILLS CAPITAL MANAGEMENT LLC,136 S CLARK DRIVE,BEVERLY HILLS,CA,United States,90211,(310) 742-6728,,10325267,
"SHANZER, HERBERT MARTIN",SHANZER MANAGEMENT,,,,,,978-392-1508,,10331300,0
"ABOUND WEALTH STRATEGIES, LLC",ABOUND WEALTH STRATEGIES,9101 WESLEYAN RD,INDIANAPOLIS,IN,United States,46268,317-672-2591,http://aboundwealthstrategies.com,10336820,11-25
"FINANCIAL ABUNDANCE, LLC","FINANCIAL ABUNDANCE, LLC",,,,,,303-554-0309,,10340006,1-10
"HAVEN FINANCIAL SOLUTIONS, INC","HAVEN FINANCIAL SOLUTIONS, INC",,,,,,847-864-2761,HTTP://WWW.HAVENFINANCIALSOLUTIONS.COM,10342236,26-50
"BARNAI ASSET MANAGEMENT, LLC",BARNAI ASSET MANAGEMENT,,,,,,303-601-1410,HTTPS://WWW.BARNAIASSETMANAGEMENT.COM,10351826,
"GRANITE HILL CAPITAL MANAGEMENT, LLC","GRANITE HILL CAPITAL MANAGEMENT, LLC",,,,,,203-431-4447,HTTP://WWW.GRANITEHILLCAPITAL.COM,10357154,1-10
MBB ADVISORY LLC,MBB ADVISORY LLC,,,,,,917-834-4742,,10357537,0
SPOTLIGHT INVESTMENT LLC,SPOTLIGHT INVESTMENT LLC,,,,,,954-681-1169,http://www.spotlightinvestment.com,10357588,0
LIMBER CAPITAL LLC,LIMBER CAPITAL LLC,,,,,,218-205-4361,,10358583,
MIRICA WEALTH MANAGEMENT LLC,MIRICA WEALTH,,,,,,617-658-3381,https://www.Linkedin.com/in/rnrazvan,10359420,26-50
THE HUGHES GROUP WEALTH MANAGEMENT PARTNERS LLC,THE HUGHES GROUP WEALTH MANAGEMENT PARTNERS LLC,11824 JOLLYVILLE ROAD,AUSTIN,TX,United States,78759,512-582-4893,HTTP://THEHUGHESGROUPTEXAS.COM,10360000,0
"TKM FINANCIAL SERVICES, LLC","TKM FINANCIAL SERVICES, LLC","10602 TIMBERWOOD CIRCLE, #2",LOUISVILLE,KY,United States,40223,502.450.7526,http://www.linkedin.com/in/todd-k-meador-mba-cfp®-ctfa-a783ba56,10360006,11-25
"SHARMA ASSOCIATES, INC.","SHARMA ASSOCIATES, INC.",,,,,,610-828-8253,HTTP://WWW.SHARMAH.COM,10380282,
"WALDO INVESTMENT ADVISORS, LLC","WALDO INVESTMENT ADVISORS, LLC",,,,,,800-694-0492,https://www.linkedin.com/in/james-waldo-b27363b1/,10382330,
ALPHYN CAPITAL MANAGEMENT LLC,ALPHYN CAPITAL MANAGEMENT LLC,100 DUFFY AVENUE,HICKSVILLE,NY,United States,11801,646-596-1682,https://www.alphyncap.com,10390447,
"EAMON CAPITAL MANAGEMENT, LLC","EAMON CAPITAL MANAGEMENT, LLC",7500 BROOKTREE ROAD,WEXFORD,PA,United States,15090,(412) 324-6034,http://www.eamoncap.com/,10397518,1-10
"FINANCIAL CONSULTING PROFESSIONALS, LLC","FINANCIAL CONSULTING PROFESSIONALS, LLC",7028 E. FRIESS DRIVE,SCOTTSDALE,AZ,United States,85254,480-463-0842,http://financialconsultingprofessionals.com/,10400000,1-10
"FORTIUS FINANCIAL ADVISORS, LLC","FORTIUS FINANCIAL ADVISORS, LLC",4001 SOUTH 700 EAST,SALT LAKE CITY,UT,United States,84107,888-365-7009,HTTPS://WWW.FORTIUSADVISORS.COM,10400408,0
"ROWE CONSULTING GROUP, LLC","ROWE CONSULTING GROUP, LLC",,,,,,312-913-9872,https://www.enhancedhedge.com,10405902,
HARWOOD INVESTMENT GROUP LLC,HARWOOD INVESTMENT GROUP LLC,2593 BROAD AVENUE,MEMPHIS,TN,United States,38112,901-685-3355,,10411686,
"HACKET ASSET MANAGEMENT, INC.","HACKET ASSET MANAGEMENT, INC.",,,,,,401--739-6660,,10421757,
"FALCON POINT CAPITAL, LLC","FALCON POINT CAPITAL, LLC",,,,,,415-782-9600,HTTP://FALCONPOINTCAPITAL.COM/,10425007,0
EOS FINANCIAL PLANNING LLC,EOS FINANCIAL PLANNING LLC,,,,,,617-286-6822,HTTPS://WWW.EOSFP.COM/,10426501,11-25
"BMA ADVISORS, LLC","BMA ADVISORS, LLC",,,,,,310-544-3545,HTTPS://WWW.BMAADVISORS.COM,10428424,0
"OXFORD MARTIN, LLC","OXFORD MARTIN, LLC",ONE ESSEX GREEN DRIVE,PEABODY,MA,United States,01960,617-932-9861,http://www.oxfordmartin.com,10430242,0
"GOYDAS CAPITAL INVESTMENT MANAGEMENT, LLC","GOYDAS CAPITAL INVESTMENT MANAGEMENT, LLC",,,,,,(917) 288-1578,https://www.facebook.com/Goydas-Capital-Investment-Management-261946217624584/,10434275,0
"WALTERS STRATEGIC ADVISORS, LLC","WALTERS STRATEGIC ADVISORS, LLC",5266 OFFICE PARK BLVD,BRADENTON,FL,United States,34203,941-751-4224,,10439932,1-10
"KAMADA INVESTMENT MANAGEMENT, LLC",KAMADA INVESTMENT MANAGEMENT,,,,,,4254421809,HTTP://WWW.KAMADAINVESTMENT.COM,10446213,
"STEPHEN MATHIAS & CO., INC.","STEPHEN MATHIAS & CO., INC.",12655 OLIVE BLVD.,CREVE COEUR,MO,United States,63141,314-878-6364,HTTP://WWW.MATHIASCPA.COM,10446488,26-50
"GOLDEN HILLS FINANCIAL GROUP, LLC","GOLDEN HILLS FINANCIAL GROUP, LLC",,,,,,719-260-8000,HTTPS://WWW.GOLDENHILLSGROUP.COM/,10452488,0
"CONSCIENTIOUS WEALTH PLANNING AND INVESTMENT MANAGEMENT, LLC",CWPIM,8000 AVALON BLVD.,ALPHARETTA,GA,United States,30009,770-596-2692,http://cwpimriskscore.com,10452691,11-25
ROCKRIDGE MONEY MANAGEMENT LLC,ROCKRIDGE MONEY MANAGEMENT LLC,,,,,,510-593-7431,,10455061,
KNIGHT OF CALIFORNIA LLC,KNIGHT OF CALIFORNIA LLC,,,,,,831-884-5280,,10456376,
"WITTER & WESTLAKE INVESTMENTS, INC.",WITTER & WESTLAKE INVESTMENTS,,,,,,502-339-8840,HTTP://WWW.WITTERWESTLAKE.COM,10462000,
BLUE CREEK ASSET MANAGEMENT,BLUE CREEK ASSET MANAGEMENT,,,,,,931-580-6999,,10468200,0
"RENOVATE FINANCIAL PLANNING, LLC",RENOVATE FINANCIAL PLANNING,,,,,,612-438-2737,,10470190,11-25
"BRIGHTSTONE CAPITAL MANAGEMENT, LLC","BRIGHTSTONE CAPITAL MANAGEMENT, LLC",CORPORATE BOX 10,"ST. CLAIR, PORT-OF-SPAIN",,Trinidad and Tobago,,1 (740) 409-8235,,10477953,
"ARGOS GLOBAL ADVISORS, LLC","ARGOS GLOBAL ADVISORS, LLC",812 ANACAPA ST.,SANTA BARBARA,CA,United States,93101,805-203-1208,HTTP://WWW.ARGOSGLOBAL.US.COM/,10487438,
"TORO BRAVO INVESTMENT ADVISORS, LLC","TORO BRAVO INVESTMENT ADVISORS, LLC",3418 OLSEN BLVD,AMARILLO,TX,United States,79109,(806) 359-7766,https://www.torobravoadvisors.com,10491572,51-100
TRILLIUM SQUARE ADVISORS LLC,TRILLIUM SQUARE ADVISORS LLC,,,,,,(919) 825-1818,https://www.facebook.com/trilliumsquare,10493129,26-50
"NEUSE RIVER CAPITAL, LLC","NEUSE RIVER CAPITAL, LLC",,,,,,919.274.8982,HTTP://WWW.NEUSERIVERCAPITAL.COM,10500000,0
"MARATHON INVESTMENTS, LLC","MARATHON INVESTMENTS, LLC",,,,,,203-972-6024,,10500000,1-10
"JONES CAPITAL ADVISORS, LLC","JONES CAPITAL ADVISORS, LLC",1022 E. 15TH STREET,PLANO,TX,United States,75074,214-587-9774,HTTP://WWW.JONESCAPITALADVISORS.COM,10500000,11-25
"PEACHER, INC.","PEACHER, INC.",331 EMERALD BAY,LAGUNA BEACH,CA,United States,92651,858-699-5427,,10500000,0
"BCM WEALTH MANAGEMENT, LLC.","BCM WEALTH MANAGEMENT, LLC.",,,,,,7206449360,,10500000,
TIERCEL CAPITAL TEXAS LLC,TIERCEL CAPITAL TEXAS LLC,1601 RONSON RD,HOUSTON,TX,United States,77055,713-478-3702,https://www.linkedin.com/in/romackay?,10500000,
"CAPITAL PORTFOLIO MANAGEMENT, INC.","CAPITAL PORTFOLIO MANAGEMENT, INC.",9515 DEERECO RD,TIMONIUM,MD,United States,21093,410-667-4575,HTTP://WWW.CPMINVESTMENTS.COM,10500000,
"GEYER, FRANK EUGENE",GEYER INVESTMENT ADVISORS,,,,,,406-581-0794,HTTP://GEYERINVEST.COM,10500000,0
"PAMELA KRUEGER AND COMPANY, INC.","PAMELA KRUEGER AND COMPANY, INC.",,,,,,512-680-2016,HTTP://WWW.PAMELAKRUEGER.COM,10500000,
"NOBLE CAPITAL MANAGEMENT, INC.","NOBLE CAPITAL MANAGEMENT, INC.",150 EAST PALMETTO PARK ROAD,BOCA RATON,FL,United States,33432,561-994-1191,http://www.noblecapitalmarkets.com,10500000,
"INDEPENDENT INVESTMENT ADVISORS, INC.","INDEPENDENT INVESTMENT ADVISORS, INC.",901 MOPAC EXPRESSWAY SOUTH,AUSTIN,TX,United States,78746,512-481-2575,,10500000,
"PEBBLE MANAGEMENT GROUP, LLC",PEBBLE MANAGEMENT GROUP,3500 N. CAUSEWAY BLVD.,METAIRIE,LA,United States,70002,504-401-0179,HTTP://WWW.PEBBLEMG.COM,10500000,0
MANDALA FINANCIAL ADVISORS LLC,MANDALA FINANCIAL ADVISORS LLC,,,,,,312-890-6221,https://www.facebook.com/mandala.financial/,10500000,11-25
"DENNY, BARRY T.","DENNY, BARRY T.",,,,,,906-779-2132,,10500000,1-10
TKG FINANCIAL LLC,TKG FINANCIAL LLC,,,,,,253-444-8544,,10500000,
RIGHT TAIL CAPITAL LLC,RIGHT TAIL CAPITAL LLC,,,,,,443-690-3547,https://www.righttailcapital.com,10500000,
"TARRAGON CAPITAL, LLC","TARRAGON CAPITAL, LLC",345 FRAZIER AVENUE,CHATTANOOGA,TN,United States,37405,423-400-8072,http://www.linkedin.com/in/kyle-kelly-9268344b/,10500659,1-10
"PLANNING FOR WEALTH, LLC","PLANNING FOR WEALTH, LLC",1900 ROSELAWN AVENUE,MONROE,LA,United States,71201,318-340-0324,https://www.pfwllc.com,10522323,1-10
"MILLENNIAL WEALTH MANAGEMENT, LLC","MILLENNIAL WEALTH MANAGEMENT, LLC",2095 W. 6TH AVENUE,BROOMFIELD,CO,United States,80020,(303)578-8535,https://www.linkedin.com/company/millennial-wealth-management-llc,10541200,51-100
ALESIA INVESTMENT MANAGEMENT LLC,ALESIA INVESTMENT MANAGEMENT LLC,,,,,,(818) 458-8459,HTTPS://WWW.ALESIAINV.COM,10547867,1-10
"EMPOWERING FINANCE, LLC","EMPOWERING FINANCE, LLC",,,,,,(503) 213-6463,https://www.facebook.com/empoweringfinances,10556117,51-100
"PERPETUAL CAPITAL ADVISORS, LLC","PERPETUAL CAPITAL ADVISORS, LLC",,,,,,775-302-0002,HTTPS://WWW.FACEBOOK.COM/PERPETUALADVISORS.COM,10557949,26-50
"LOCKER WEALTH MANAGEMENT, INC.","LOCKER WEALTH MANAGEMENT, INC.",,,,,,708-960-0520,HTTPS://WWW.FACEBOOK.COM/LOCKERWEALTH,10563000,26-50
"MILLENNIUM PLANNING GROUP, LLC","MILLENNIUM PLANNING GROUP, LLC",,,,,,984-214-8540,Https://www.facebook.com/michaelwhitmanmba,10563793,11-25
"ROWEN CAPITAL MANAGEMENT, LLC","ROWEN CAPITAL MANAGEMENT, LLC",,,,,,(415) 875-9348,,10575054,0
"BRENTWOOD 401K, LLC","BRENTWOOD 401K, LLC",,,,,,847-477-2784,HTTP://WWW.BRENTWOOD401K.COM,10580300,0
AMAUTA LLC,AMAUTA FINANCIAL,,,,,,202-607-0298,HTTPS://WWW.AMAUTAFINANCIAL.COM,10582488,0
"WEALTH MANAGEMENT SERVICES OF AUSTIN, LLC","WEALTH MANAGEMENT SERVICES OF AUSTIN, LLC",901 S. MOPAC EXPRESSWAY,AUSTIN,TX,United States,78746,512-478-0008,HTTPS://WWW.LINKEDIN.COM/IN/WEALTHAUSTIN/,10584366,0
BOCA RETIREMENT STRATEGIES INC.,BOCA RETIREMENT STRATEGIES INC.,,,,,,413-358-1176,https://www.bocaretirement.com,10585261,51-100
COX GESTAO DE RECURSOS LTDA.,COX CAPITAL MANAGEMENT,"RUA JOAQUIM FLORIANO, 466 - CJ 1203",SÃO PAULO,,Brazil,04534-002,+55.11.3321.7100,HTTP://WWW.COXCAP.COM.BR,10590091,
"ROTH INVESTMENT MANAGEMENT, LLC","ROTH INVESTMENT MANAGEMENT, LLC",,,,,,636-432-2000,https://www.investwithroth.com,10591577,1-10
HINDE GROUP LLC,HINDE GROUP LLC,580 CALIFORNIA ST.,SAN FRANCISCO,CA,United States,94104,415-992-8125,HTTP://WWW.HINDE-GROUP.COM,10595005,
"TEXAS REGISTERED FINANCIAL CONSULTANTS, PLLC",ASSET GROWTH ASSOCIATES WEALTH ADVISORS,1391 CALDER AVENUE,BEAUMONT,TX,United States,77701,409 840-6900,HTTP://WWW.SAVEMYRETIREMENT.COM,10597952,1-10
CSUITE INVESTMENT LLC,CSUITE INVESTMENT LLC,"535 MISSION ST., 14TH FL",SAN FRANCISCO,CA,United States,94105,415-861-9461,HTTP://WWW.CSUITEINVESTMENT.COM,10598134,1-10
"TERMINUS, LLC","TERMINUS, LLC",,,,,,888-456-7597,HTTP://WWW.TERMINUSINVESTMENT.COM,10600000,
"LIFETIME STRATEGIES, LLC","LIFETIME STRATEGIES, LLC",200 E COLLEGE ST,GRIFFIN,GA,United States,30224,770-228-0777,http://www.lifetime-strategies.com/,10606131,1-10
"RUTHERFORD CAPITAL, INC.","RUTHERFORD CAPITAL, INC.",5925 GRANITE LAKE DRIVE,GRANITE BAY,CA,United States,95746,916-462-8931,,10609479,
KBC HOLDINGS LLC,KANON BLOCH CARRE,,,,,,781 792 2930,,10612784,1-10
"RLR CAPITAL MANAGEMENT, INC.","RLR CAPITAL MANAGEMENT, INC.","76 ELM STREET, SUITE 205",NEW CANAAN,CT,United States,06840,203-966-1801,HTTP://RLRCAPITALMANAGEMENT.COM,10613297,
DARREN MOSS WEALTH MANAGEMENT LLC,D. MOSS WEALTH MANAGEMENT,,,,,,(310) 579-4050,https://www.dmosswealth.com,10616423,1-10
BRIAN SCOTT KUHENS,BRIAN SCOTT KUHENS,,,,,,(864) 431-5195,,10619252,0
"CYGNET INVESTMENT CO., INC.","CYGNET INVESTMENT CO., INC.",,,,,,203-856-0774,,10619473,0
"LASETER, DONALD LEE",FINANCIAL CONSULTING SERVICES,,,,,,214-923-8767,,10625492,1-10
"TORRE, FEDERICO",TORRE FINANCIAL,,,,,,8326060294,https://torrefinancial.com,10629776,
"GOLD COAST ADVISORS, LLC","GOLD COAST ADVISORS, LLC","130 SHORE ROAD, SUITE 235",PORT WASHINGTON,NY,United States,11050,516-944-0081,HTTPS://WWW.GCALLC.COM,10630000,1-10
"TRITON INVESTMENTS, LLC","TRITON INVESTMENTS, LLC",,,,,,701-425-2016,https://tritoninvestments.net,10632563,
"AEGIS ASSET MANAGEMENT, INC.","AEGIS ASSET MANAGEMENT, INC.",2331 WEST LINCOLN AVENUE,ANAHEIM,CA,United States,92801,714-635-9900,,10636628,
SIPHRON CAPITAL MANAGEMENT,SIPHRON CAPITAL MANAGEMENT,3500 WEST OLIVE AVENUE,BURBANK,CA,United States,91505,(310) 858-7281,HTTP://WWW.SIPHRONCAPITAL.COM,10636764,
"WEALTH PLANNING SYSTEMS, LLC","WEALTH PLANNING SYSTEMS, LLC",,,,,,952-881-6081,,10640000,0
"TUYYO PLANNING GROUP, LLC",TUYYO PLANNING GROUP,,,,,,512-522-0201,http://www.tuyyoplanning.com,10640805,26-50
"CHARTER INVESTMENT SERVICES, INC.","CHARTER INVESTMENT SERVICES, INC.",,,,,,402-680-8185,,10661642,0
"GOOD LIFE ASSET STRATEGIES, LLC",GOOD LIFE ASSET STRATEGIES,1401 JONES STREET,FORT WORTH,TX,United States,76102,405-757-0210,https://www.goodlifeassetstrategies.com,10669000,0
J1 CAPITAL LLC,J1 CAPITAL LLC,,,,,,513-580-8088,,10678343,0
"EXHALE WEALTH MANAGEMENT, LLC",EXHALE WEALTH,,,,,,858-231-3645,https://www.linkedin.com/company/82505167,10688568,1-10
"SWEETWOOD FAMILY CAPITAL, LLC","SWEETWOOD FAMILY CAPITAL, LLC",,,,,,(207) 272-3133,https://sweetwoodfamily.capital,10695708,1-10
CUSTOM FUNDS MANAGEMENT LLC,CUSTOM FUNDS MANAGEMENT LLC,,,,,,612-720-5170,HTTPS://WWW.LINKEDIN.COM,10700000,
PLANIT FINANCIAL LLC,PLANIT FINANCIAL LLC,,,,,,206-660-2821,https://linkedin.com/in/keith-mayfield-planit-401k,10700000,
"STRATTON CAPITAL MANAGEMENT, LLC","STRATTON CAPITAL MANAGEMENT, LLC",,,,,,603-472-4044,,10700000,0
RICHARD A. STEBBINS,RICHARD A. STEBBINS CPA CFP CMFC,,,,,,2488407810,,10700000,0
"WEISBERG, PHILIP SIDNEY",WEISBERG FINANCIAL SERVICES,,,,,,585-467-3266,,10700000,0
ABC WEALTH INC,ABC WEALTH INC,,,,,,908-655-6494,HTTP://www.ABCWealth.com/,10700002,0
"SURE FOUNDATION WEALTH PLANNING, LLC","SURE FOUNDATION WEALTH PLANNING, LLC",295 WEST TRAIL,GRAYSLAKE,IL,United States,60030,847-244-6149,https://www.surefoundationwealth.com,10701886,0
"BELWOOD CAPITAL MANAGEMENT, LLC","BELWOOD CAPITAL MANAGEMENT, LLC",,,,,,347-255-1737,,10704545,
LTS FINANCIAL GROUP,LTS FINANCIAL GROUP,6300 RIDGLEA PLACE,FT. WORTH,TX,United States,76116,817-585-1590,,10707308,
GILBERT INVESTMENT MANAGEMENT INC,GILBERT INVESTMENT MANAGEMENT,20 MCKENNA TER,BOSTON,MA,United States,02132,207-232-8323,http://www.gilbertim.com,10719291,0
"CASHEN ADVISORY SERVICES, LLC","CASHEN ADVISORY SERVICES, LLC",,,,,,(317) 733-2976,,10727298,0
